{"facets":["content-package"],"integrity":{"root_block_hash":"sha256:4a1ee161965650d953f725102b0de6475434931bbe80ece2df7e876180f55854"},"layout":{"memory":"docs/memory","scratch":[".agent-scratch"]},"overlays":["agent-governance"],"policy":{"mandatory":[],"root":"AGENTS.md"},"project_id":"agent-project-guides","protected_effects":[],"provider":{"digest":"observe","mode":"source-worktree","release":"4.0.1","source":"."},"schema_version":1}
